{
 "projeto": "<proj>",
 "clipes": [
  "CLIP_PLACEHOLDER/mentos_bruto.MOV"
 ],
 "objetivo": "seguidor",
 "plataforma": [
  "reels",
  "tiktok"
 ],
 "formato": "9:16",
 "tipo": "produto",
 "ja_editado": true,
 "nivel": "maximo",
 "restricoes": [
  "melhora o visual de 12 a 16s, tá fraco perto dos concorrentes"
 ],
 "cta": "TOQUE NO CARRINHO"
}